{
  "version": 3,
  "enabled": true,
  "sensitivityYaw": 1.0,
  "sensitivityPitch": 1.0,
  "invertVertical": false,
  "maxPitchDegrees": 45.0,
  "resetOnInventoryClose": true,
  "smoothingFactor": 0.45,
  "boundsMinX": 0.0,
  "boundsMinY": 0.0,
  "boundsMaxX": 1.0,
  "boundsMaxY": 1.0,
  "expectedMinecraftVersion": "26.60",
  "allowSymbolAutoProbe": true,
  "allowNativeInputQueueFallback": true,
  "verifiedSignaturesReady": false,
  "hudPlayerRendererRenderSig": "",
  "getLocalPlayerFromClientSig": "",
  "actorGetRotationSig": "",
  "actorRotYawOffset": 0,
  "actorRotPitchOffset": 0,
  "mobBodyYawOffset": 0,
  "mobHeadYawOffset": 0
}
